{
  "$schema": "./openai-result.schema.json",
  "schema_version": 1,
  "run": {
    "id": "20260712T104428Z-gpt-5.6-sol-xhigh",
    "started_at": "2026-07-12T10:44:28.919691+00:00",
    "completed_at": "2026-07-12T10:47:07.016406+00:00",
    "status": "success"
  },
  "benchmark": {
    "task": "alman_bench",
    "dataset": "curated",
    "sample_count": 48,
    "spec_in_context": true,
    "spec_examples_in_dataset": false,
    "commit": "b66e4916698782cabb8f376b52ae98c99b5d1796",
    "working_tree_dirty": false
  },
  "model": {
    "requested": "gpt-5.6-sol",
    "label": "GPT-5.6 Sol",
    "returned_models": [
      "gpt-5.6-sol"
    ],
    "snapshot_pinned": false,
    "reasoning": {
      "enabled": true,
      "effort": "xhigh",
      "primary_call_max_completion_tokens": 4096,
      "samples_with_reasoning": 35,
      "max_primary_completion_tokens": 1631,
      "max_primary_reasoning_tokens": 1536,
      "forced_final_fallback_count": 0,
      "forced_final_effort": "none"
    }
  },
  "endpoint": {
    "platform": "openai-api",
    "provider": "openai",
    "api": "chat_completions",
    "max_concurrency": 4
  },
  "generation": {
    "primary_max_completion_tokens": 4096,
    "forced_final_max_completion_tokens": 512,
    "max_retries": 2
  },
  "results": {
    "acceptance": {
      "correct": 46,
      "total": 48,
      "rate": 0.9583333333333334,
      "stderr": 0.028842443968465525
    },
    "compliance": {
      "correct": 48,
      "total": 48,
      "rate": 1.0,
      "stderr": 0.0
    },
    "groups": {
      "ablaut": {
        "correct": 2,
        "total": 2,
        "rate": 1.0,
        "stderr": 0.0
      },
      "berufe": {
        "correct": 5,
        "total": 5,
        "rate": 1.0,
        "stderr": 0.0
      },
      "deutsch-alman": {
        "correct": 11,
        "total": 11,
        "rate": 1.0,
        "stderr": 0.0
      },
      "die-verwandlung": {
        "correct": 3,
        "total": 4,
        "rate": 0.75,
        "stderr": 0.21650635094610965
      },
      "siddhartha": {
        "correct": 15,
        "total": 16,
        "rate": 0.9375,
        "stderr": 0.06051536478449089
      },
      "starke-flexion": {
        "correct": 8,
        "total": 8,
        "rate": 1.0,
        "stderr": 0.0
      },
      "steppenwolf": {
        "correct": 2,
        "total": 2,
        "rate": 1.0,
        "stderr": 0.0
      }
    },
    "tokens": {
      "input": 597073,
      "cached_input": 12413,
      "output": 13803,
      "reasoning": 12146,
      "total": 610876
    },
    "estimated_cost_usd": 3.3435965
  },
  "pricing": {
    "currency": "USD",
    "input_per_million_tokens": 5.0,
    "cached_input_per_million_tokens": 0.5,
    "output_per_million_tokens": 30.0,
    "observed_at": "2026-07-12T10:10:00Z"
  },
  "artifacts": {
    "samples_jsonl": "/home/onur/scratch/alman-benchmark-runs/openai/20260712T102000Z-openai-xhigh/gpt-5.6-sol-xhigh.samples.jsonl"
  }
}
