{
  "$schema": "./openai-result.schema.json",
  "schema_version": 1,
  "run": {
    "id": "20260715T184828Z-gpt-5.6-luna-xhigh",
    "started_at": "2026-07-15T18:48:28.068846+00:00",
    "completed_at": "2026-07-15T18:48:56.934276+00:00",
    "status": "success"
  },
  "benchmark": {
    "task": "alman_bench",
    "dataset": "curated",
    "sample_count": 87,
    "spec_in_context": true,
    "spec_examples_in_dataset": false,
    "commit": "f65b43920d1dabe931d1a2ef82a396297ed969a0",
    "working_tree_dirty": false
  },
  "model": {
    "requested": "gpt-5.6-luna",
    "label": "GPT-5.6 Luna",
    "returned_models": [
      "gpt-5.6-luna"
    ],
    "snapshot_pinned": false,
    "reasoning": {
      "enabled": true,
      "effort": "xhigh",
      "primary_call_max_completion_tokens": 4096,
      "samples_with_reasoning": 86,
      "max_primary_completion_tokens": 4096,
      "max_primary_reasoning_tokens": 4096,
      "forced_final_fallback_count": 1,
      "forced_final_effort": "none"
    }
  },
  "endpoint": {
    "platform": "openai-api",
    "provider": "openai",
    "api": "chat_completions",
    "max_concurrency": 4
  },
  "generation": {
    "primary_max_completion_tokens": 4096,
    "forced_final_max_completion_tokens": 512,
    "max_retries": 2
  },
  "results": {
    "acceptance": {
      "correct": 78,
      "total": 87,
      "rate": 0.896551724137931,
      "stderr": 0.032650488032689606
    },
    "compliance": {
      "correct": 86,
      "total": 87,
      "rate": 0.9885057471264368,
      "stderr": 0.011428003025660402
    },
    "groups": {
      "ablaut": {
        "correct": 2,
        "total": 2,
        "rate": 1.0,
        "stderr": 0.0
      },
      "berufe": {
        "correct": 5,
        "total": 5,
        "rate": 1.0,
        "stderr": 0.0
      },
      "deutsch-alman": {
        "correct": 11,
        "total": 11,
        "rate": 1.0,
        "stderr": 0.0
      },
      "die-verwandlung": {
        "correct": 4,
        "total": 4,
        "rate": 1.0,
        "stderr": 0.0
      },
      "regelabdeckung": {
        "correct": 25,
        "total": 26,
        "rate": 0.9615384615384616,
        "stderr": 0.03771464137272768
      },
      "relativsaetze": {
        "correct": 12,
        "total": 13,
        "rate": 0.9230769230769231,
        "stderr": 0.07390530175619404
      },
      "siddhartha": {
        "correct": 11,
        "total": 16,
        "rate": 0.6875,
        "stderr": 0.11587810136086973
      },
      "starke-flexion": {
        "correct": 8,
        "total": 8,
        "rate": 1.0,
        "stderr": 0.0
      },
      "steppenwolf": {
        "correct": 0,
        "total": 2,
        "rate": 0.0,
        "stderr": 0.0
      }
    },
    "tokens": {
      "input": 1174506,
      "cached_input": 614124,
      "output": 32019,
      "reasoning": 29462,
      "total": 1206525
    },
    "estimated_cost_usd": 0.8139084
  },
  "pricing": {
    "currency": "USD",
    "input_per_million_tokens": 1.0,
    "cached_input_per_million_tokens": 0.1,
    "output_per_million_tokens": 6.0,
    "observed_at": "2026-07-12T10:10:00Z"
  },
  "artifacts": {
    "samples_jsonl": "/home/onur/scratch/alman-benchmark-runs/incremental-87/openai/20260715T140000Z-87/gpt-5.6-luna-xhigh.samples.jsonl"
  }
}
