{
  "$schema": "./openai-result.schema.json",
  "schema_version": 1,
  "run": {
    "id": "20260713T073108Z-gpt-5.4-mini-xhigh",
    "started_at": "2026-07-13T07:31:08.352064+00:00",
    "completed_at": "2026-07-13T07:35:48.098829+00:00",
    "status": "success"
  },
  "benchmark": {
    "task": "alman_bench",
    "dataset": "curated",
    "sample_count": 48,
    "spec_in_context": true,
    "spec_examples_in_dataset": false,
    "commit": "f2e73526fd96984fa17403297be9b01cbc2c4031",
    "working_tree_dirty": false
  },
  "model": {
    "requested": "gpt-5.4-mini-2026-03-17",
    "label": "GPT-5.4 mini",
    "returned_models": [
      "gpt-5.4-mini-2026-03-17"
    ],
    "snapshot_pinned": true,
    "reasoning": {
      "enabled": true,
      "effort": "xhigh",
      "primary_call_max_completion_tokens": 4096,
      "samples_with_reasoning": 48,
      "max_primary_completion_tokens": 4096,
      "max_primary_reasoning_tokens": 4096,
      "forced_final_fallback_count": 25,
      "forced_final_effort": "none"
    }
  },
  "endpoint": {
    "platform": "openai-api",
    "provider": "openai",
    "api": "chat_completions",
    "max_concurrency": 4
  },
  "generation": {
    "primary_max_completion_tokens": 4096,
    "forced_final_max_completion_tokens": 512,
    "max_retries": 2
  },
  "results": {
    "acceptance": {
      "correct": 29,
      "total": 48,
      "rate": 0.6041666666666666,
      "stderr": 0.07058524774394487
    },
    "compliance": {
      "correct": 42,
      "total": 48,
      "rate": 0.875,
      "stderr": 0.047735163489123336
    },
    "groups": {
      "ablaut": {
        "correct": 2,
        "total": 2,
        "rate": 1.0,
        "stderr": 0.0
      },
      "berufe": {
        "correct": 5,
        "total": 5,
        "rate": 1.0,
        "stderr": 0.0
      },
      "deutsch-alman": {
        "correct": 10,
        "total": 11,
        "rate": 0.9090909090909091,
        "stderr": 0.08667841720414476
      },
      "die-verwandlung": {
        "correct": 2,
        "total": 4,
        "rate": 0.5,
        "stderr": 0.25
      },
      "siddhartha": {
        "correct": 2,
        "total": 16,
        "rate": 0.125,
        "stderr": 0.08267972847076846
      },
      "starke-flexion": {
        "correct": 8,
        "total": 8,
        "rate": 1.0,
        "stderr": 0.0
      },
      "steppenwolf": {
        "correct": 0,
        "total": 2,
        "rate": 0.0,
        "stderr": 0.0
      }
    },
    "tokens": {
      "input": 975703,
      "cached_input": 953088,
      "output": 113978,
      "reasoning": 112409,
      "total": 1089681
    },
    "estimated_cost_usd": 0.60134385
  },
  "pricing": {
    "currency": "USD",
    "input_per_million_tokens": 0.75,
    "cached_input_per_million_tokens": 0.075,
    "output_per_million_tokens": 4.5,
    "observed_at": "2026-07-12T10:10:00Z"
  },
  "artifacts": {
    "samples_jsonl": "/home/onur/scratch/alman-benchmark-runs/openai/20260713T073107Z-updated-rules-corrected/gpt-5.4-mini-xhigh.samples.jsonl"
  }
}
